[
  {"evaluation_id":"syn-ev","decision_id":"syn-d","effect_ref":{"effect_kind":"HUMAN_ACTION","effect_id":"syn-a"},"outcome_ids":["syn-o"],"evaluated_at":"2026-09-10T11:00:00+07:00","result":"INCONCLUSIVE","evidence_ids":[],"limitations":["synthetic only"],"notes":"No business or operated proof."}
]
